
BigBasket (BBKT),DMart (DMRT),Reliance Fresh (RFSH),Spencer's (SPNC),More Supermarket (MORE),Nature's Basket (NBKT),Grofers/Blinkit (BLNK),JioMart (JMRT),Spar Hypermarket (SPAR),Star Bazaar (STBZ),Nilgiris (NLGR),Food Bazaar (FDBZ),Ratnadeep Supermarket (RTDP),Namdhari's Fresh (NMDH),Easyday (ESDY),Godrej Nature's Basket (GNBK),Sahakari Bhandar (SHKR),Patel's R Mart (PTLM),Heritage Fresh (HRTG),HyperCity (HCTY),Reliance Smart (RSMT),Auchan (ACHN),Lulu Hypermarket (LULU),Metro Cash & Carry (MTRO),Easyday Club (EDCL),Safal (SFAL),FoodWorld (FDWD),Reliance Market (RMKT),Max Hypermarket (MXHP),Food Court (FDCT),More For You (MFYU),Value Zone (VLZN),Food Square (FDSQ),Apna Bazar (APBZ),Krishnagro (KRGR),Le Marche (LMRC),Modern Bazaar (MDBZ),Reliance Smart Point (RSPT),Balaji Super Market (BLSM),Reliance Fresh Daily (RFSD),V Mart (VMRT),Shreeji Super Market (SJSM),Q Mart Hyderabad (QMRT),Vijetha Supermarket (VJTH),Magsons (MGSN),Fortune Mart (FTMT),Hyderabad Fresh (HYDF),Neerus Fresh Mart (NRFM),Aarogya Organic Foods (AORG),MK Retail (MKRT),Smart Bazaar (SMBZ),Jubilee Bazaar (JBBZ),Royal Mart (RYMT),Twenty Four Seven (24X7),Patanjali Store (PTNJ),Maruthi Supermarket (MRTS),Hyderabad Mart (HYDM),GS Retail (GSRT),Vishwaas Super Store (VSST),Noble Plus Supermarket (NPLS),Mohammedia Supermarket (MHMD),Sampoorna Supermarket (SAMP),Ushodaya Supermarket (USHD)


Myntra (MYNT),Flipkart (FLPK),Amazon India (AMZN),Ajio (AJIO),Nykaa (NYKA),Tata CLiQ (TCLQ),Reliance Trends (RTRD),Shoppers Stop (SHST),Lifestyle (LFST),Westside (WSTS),Pantaloons (PNTL),Max Fashion (MXFS),Croma (CRMA),Vijay Sales (VJSL),Reliance Digital (RDGT),Jabong (JBNG),Snapdeal (SNDL),Koovs (KOVS),Shopclues (SHCL),Limeroad (LMRD),Pepperfry (PPFR),Urban Ladder (URLD),Fabindia (FBID),Reliance Footprint (RFTP),Central (CNTL),Brand Factory (BRFT),Vishal Mega Mart (VSHL),V-Mart (VMRT),Zivame (ZVME),Biba (BIBA),Manyavar (MNVR),FirstCry (FCRY),BabyOye (BBYE),Purplle (PRPL),Health & Glow (HLGW),Meesho (MSHO),Fashnear (FSNR),StalkBuyLove (STBL),Roposo (ROPO),Bewakoof (BWKF),LBB (Little Black Book) (LBLB),Kalamandir (KLMN),CMR Shopping Mall (CMRM),RS Brothers (RSBR),Hyderabad Shopping Mall (HDSM),Sagar Shopping Mall (SGRM),South India Shopping Mall (SISM),Chermas (CHRM),Chennai Silks (CHSL),Kalanikethan (KLNK),Kalaniketan (KLKT),Mangatrai Jewellers (MNGJ),GRT Jewellers (GRTJ),Tanishq (TNSH),CaratLane (CRTL),P.C. Jewellers (PCJW)


Zomato (ZMTO),Swiggy (SWGY),Domino's Pizza (DMNP),McDonald's (MCDO),Haldiram's (HLDR),Cafe Coffee Day (CCD),Behrouz Biryani (BHRZ),Faasos (FASO),Pizza Hut (PZHT),KFC India (KFCI),Burger King India (BKNG),Chai Point (CHPT),Subway India (SBWY),Barbeque Nation (BBQN),Box8 (BOX8),Biryani by Kilo (BBYK),Oven Story Pizza (OVSP),Smoke House Deli (SHDL),Theobroma (THBR),Smoor (SMOR),Starbucks India (SBKS),Costa Coffee India (COST),Wow! Momo (WMMO),The Belgian Waffle Co. (BWAF),Social (SOCL),The Beer Cafe (BRCF),Bikanervala (BKVL),Nirula's (NRUL),Yo! China (YOCH),Mad Over Donuts (MODN),Chai Sutta Bar (CHSB),Goli Vada Pav (GVDP),Rollsking (RLKG),Taco Bell (TCBL),Nando's (NNDO),The Big Chill (BGCH),Naturals Ice Cream (NICA),Cream Centre (CRCN),The Chocolate Room (CHCR),Dunkin' Donuts (DNKN),Paradise Biryani (PRDZ),Mehfil Restaurant (MHFL),Kritunga Restaurant (KRTG),Bawarchi Hyderabad (BWCH),Chutneys (CHTN),Ohri's (OHRS),Pista House (PSTH),Shah Ghouse (SHGH),Alpha Hotel (ALPH),Karachi Bakery (KRCH)


Indian Oil (IOCL),Bharat Petroleum (BPCL),Hindustan Petroleum (HPCL),Reliance Petroleum (RLPT),Shell India (SHEL),Essar Oil (ESSR),Nayara Energy (NAYR),Adani Gas (ADNG),Total (TOTL),Gulf Oil (GULF),IndianOil SERVO (SERV),HP Gas (HPGS),Mahanagar Gas Limited (MGL),Indraprastha Gas Limited (IGL),Gujarat Gas (GUJG),Reliance Gas (RLGS),Petronet LNG (PLNG),ONGC Petro Additions Limited (OPAL),Cairn India (CARN),Petrol Pump (PTRL),Green Gas Limited (GRNG),GAIL Gas (GAIL),IGL CNG (IGLC),MGL CNG (MGLC),Adani Total Gas (ADTG),BPCL Gas (BPGS),IOCL Gas (IOGS),HPCL Gas (HPGS),Reliance CNG (RCNG),Shell Gas (SHGS),Essar CNG (ESCG),Nayara Energy CNG (NECG),ADNOC (ADNC),Jio-bp (JIOB),IndianOil XTRACARE (IOXC),Bharat Petroleum Pure for Sure (BPPS),Hindustan Petroleum Power Up (HPPU),Total Energies (TLNG),Rosneft (RSNF),BPCL Hyderabad (BPHD),IOCL Hyderabad (IOHD),HPCL Hyderabad (HPHD),Shell Secunderabad (SHSC),Reliance Pump Hyderabad (RPHD)


MakeMyTrip (MMT),Cleartrip (CLTP),Yatra (YTRA),Goibibo (GOIB),IRCTC (IRCT),OYO Rooms (OYO),Ola Cabs (OLA),Uber India (UBER),redBus (RBUS),Treebo Hotels (TREB),Fab Hotels (FABH),Taj Hotels (TAJ),Akbar Travels (AKBR),EaseMyTrip (EMT),Ixigo (IXGO),Travelguru (TGRU),TripAdvisor India (TADV),HappyEasyGo (HEG),Via.com (VIA),TravelTriangle (TTRG),Musafir.com (MSAF),RailYatri (RLYT),Zoomcar (ZMCR),Savaari Car Rentals (SVCR),Meru Cabs (MERU),Trivago India (TRVG),Agoda India (AGDA),Booking.com India (BKNG),Expedia India (EXPD),Paytm Travel (PTMT),AbhiBus (ABHI),Neemrana Hotels (NMRN),Sterling Holidays (STRL),Thomas Cook India (TCOK),SOTC Travel (SOTC),Kesari Tours (KSRI),Travelport (TVPT),Travel Boutique Online (TBOL),Club Mahindra (CLBM),Leela Hotels (LELA),Lemon Tree Hotels (LMNT),Hyderabad Cabs (HYDC),Telangana Tourism (TLGT),Deccan Travels (DCNT),Andhra Pradesh Tourism (APTM),Hyderabad-Goa Travels (HYGR),AP Tourism Hotels (APTH),Royal Travels Hyderabad (RTHY)


BookMyShow (BMS),PVR Cinemas (PVR),INOX Leisure (INOX),Netflix India (NFLX),Amazon Prime Video India (APVI),Hotstar Disney+ (HSTR),Sony LIV (SLIV),Zee5 (ZEE5),JioSaavn (JSAV),Gaana (GANA),Wynk Music (WYNK),Cult.fit (CULT),Wonderla (WDRL),Imagica (IMGC),Smaaash (SMAS),TicketNew (TKTN),Insider.in (INSD),Paytm Insider (PTMI),MastiZone (MSTZ),Fun Cinemas (FUNC),Cinepolis (CNPL),Big Cinemas (BIGC),Rajhans Cinemas (RJHN),Spotify India (SPTF),Hungama (HNGM),ALTBalaji (ALTB),Voot (VOOT),Eros Now (EROS),MX Player (MXPL),ShemarooMe (SHEM),Hoichoi (HCHO),Arre (ARRE),YuppTV (YPTV),Airtel Xstream (AXST),JioCinema (JCNM),Sun NXT (SNXT),Manorama Max (MNRM),Viu (VIU),Discovery Plus (DSCP),Epic ON (EPOC),Docubay (DCBY),Prasads IMAX Hyderabad (PIMX),Asian Cinemas (ASNC),AMB Cinemas (AMBC),Sandhya 70MM (SND7),Shanti Theatre Hyderabad (SHTH),Carnival Cinemas Hyderabad (CCHD),Cineplanet Kompally (CPKM),Platinum Movietime (PLMT),Tivoli Secunderabad (TVSC)


Apollo Pharmacy (APLP),MedPlus (MDPL),Netmeds (NTMD),PharmEasy (PHEZ),1mg (1MG),Practo (PRCT),Lenskart (LNSK),Apollo Hospitals (APLO),Max Healthcare (MAXH),Fortis Healthcare (FORT),Thyrocare (THYR),Dr. Lal PathLabs (LLPL),Cult.fit (CULT),Himalaya Wellness (HMLY),Patanjali (PTNJ),Tata 1mg Labs (T1ML),DocsApp (DAPP),Medlife (MDLF),MyUpchar (MUPC),HealthifyMe (HLFM),MediBuddy (MBUD),Portea Medical (PORT),Lybrate (LBRT),mfine (MFIN),Onco.com (ONCO),Cure.fit (CURE),Healthians (HLTH),TATA Health (THLH),SRL Diagnostics (SRLD),Metropolis Healthcare (MTPH),Narayana Health (NRYN),Aster DM Healthcare (ADMC),Manipal Hospitals (MNPL),Columbia Asia Hospitals (CLBA),Care Hospitals (CARE),Wockhardt Hospitals (WOCK),Ziqitza Healthcare (ZQTZ),Docprime (DCPM),Docon (DCON),Tata Img Hospitals (TIMG),KIMS Hospitals Hyderabad (KIMS),Yashoda Hospitals (YSHD),Star Hospitals (STAR),Sunshine Hospitals (SUNS),NIMS Hyderabad (NIMS),Maxcure Hospitals (MXCR)


Tata Power (TPWR),BSES Rajdhani (BSRJ),BSES Yamuna (BSYM),Adani Electricity (ADEL),Mahanagar Gas (MGL),Airtel Payments Bank (APBK),Jio Payments Bank (JPBK),MSEB (Maharashtra State Electricity Board) (MSEB),BESCOM (Bangalore Electricity) (BSCM),Delhi Jal Board (DJB),Tata Sky (TSKY),Dish TV (DSTV),LIC India (LICI),ICICI Lombard (ICIL),Bajaj Allianz (BJAZ),Reliance Energy (RLEN),NDPL (North Delhi Power Limited) (NDPL),Torrent Power (TRNT),CESC (Calcutta Electric Supply Corporation) (CESC),KSEB (Kerala State Electricity Board) (KSEB),UPCL (Uttarakhand Power Corporation Limited) (UPCL),PSPCL (Punjab State Power Corporation Limited) (PSPC),DHBVN (Dakshin Haryana Bijli Vitran Nigam) (DHBV),UHBVN (Uttar Haryana Bijli Vitran Nigam) (UHBV),APEPDCL (Andhra Pradesh Eastern Power Distribution Company Limited) (APED),APSPDCL (Andhra Pradesh Southern Power Distribution Company Limited) (APSD),KSEB (Kerala State Electricity Board) (KSEB),JVVNL (Jaipur Vidyut Vitran Nigam Limited) (JVVN),AVVNL (Ajmer Vidyut Vitran Nigam Limited) (AVVN),MVVNL (Madhya Pradesh Vidyut Vitran Nigam Limited) (MVVN)


PhonePe (PHPE),Google Pay (GPay) (GPAY),Paytm (PYTM),Amazon Pay (AMZP),BHIM UPI (BHIM),MobiKwik (MKWK),Freecharge (FRCH),ICICI iMobile Pay (ICIM),HDFC PayZapp (HDZP),SBI YONO (YONO),Axis Mobile (AXSM),Airtel Money (ATLM),JioMoney (JIOM),WhatsApp Payments (WAPM),Yes Pay (YESP),PayU Money (PYUM),PayZapp by HDFC (PZHD),PayNearby (PYNB),Pine Labs (PINL),BharatPe (BHPE),Paytm Wallet (PTMW),Mobikwik Wallet (MKWW),Amazon Pay Wallet (AMZW),Airtel Payments Bank Wallet (APBW),JioMoney Wallet (JMWL),Paytm Money (PTMM),PayPal India (PPLI),Instamojo (INMJ),Razorpay (RZPY),Citrus Pay (CTPY),PayU (PAYU),Ezetap (EZTP),Mswipe (MSWP),CCAvenue (CCAV),BillDesk (BLDS),Juspay (JUSP),Paymate (PYMT),Paytm Postpaid (PTPP),LazyPay (LZPY),Bharat BillPay (BBPY)


Zerodha (ZRDH),Groww (GROW),Upstox (UPSX),Angel Broking (ANGL),ICICI Direct (ICID),Kotak Securities (KTKS),Sharekhan (SHKN),HDFC Securities (HDFS),SBI Cap Securities (SBIC),Motilal Oswal (MTOS),5Paisa (5PAI),Nippon India Mutual Fund (NIMF),WazirX (WZRX),CoinDCX (CDCX),CoinSwitch Kuber (CSWK),RKSV Securities (RKSV),TradePlus (TDPL),Fyers (FYER),SAMCO Securities (SAMC),IIFL Securities (IIFL),Alice Blue (ALCB),Bonanza Portfolio (BNZP),Trade Smart Online (TSMO),Geojit Financial Services (GEOF),HDFC Sky (HDSK),Reliance Securities (RELS),Aditya Birla Money (ABML),SMC Global Securities (SMCG),Karvy Stock Broking (KRVY),Religare Broking (RELB),LKP Securities (LKPS),Ventura Securities (VNTS),Anand Rathi (ANRT),Indiabulls Ventures (IBVN),Edelweiss Broking (EDLW),Axis Direct (AXDR),JM Financial Services (JMFS),Choice Broking (CHBR),Master Trust (MSTR),Nirmal Bang (NRMB)


PG Accommodations (PGAC),Housing.com (HSNG),NoBroker (NOBK),BSES (BSES),Tata Power (TPWR),Airtel Broadband (ATLB),Jio Fiber (JFBR),BYJU'S (BYJU),Unacademy (UNAC),Vedantu (VDNT),Big Basket Daily (BBKD),Urban Company (URBC),Prestige Smart Kitchen (PSGK),Nilkamal (NLKM),HomeTown (HTWN),Magicbricks (MGBK),99acres (99AC),Sulekha (SULK),Quikr Homes (QKHM),PropTiger (PPTG),Makaan.com (MKAA),Zomato Hygiene (ZMTH),Swiggy Instamart (SWIG),Dunzo (DNZO),Milkbasket (MKBS),Zepto (ZPTO),Licious (LICS),FreshToHome (FRTH),SuprDaily (SPRD),Daily Ninja (DLNJ),Ninjacart (NJCT),MyGate (MYGT),Ola Electric (OLAE),Ather Energy (ATHR),Livspace (LVSP),Pepperfry Furniture (PPFF),FabFurnish (FABF),FabHome Decor (FBHD),Homely (HMLY),Decorpot (DCPT)